<!ELEMENT LeaderDeck (LeaderCard*)>
<!ELEMENT LeaderCard (InstantLeaderEffect | PermanentLeaderEffect)>
<!ELEMENT Requirement (Properties, CardsNumber)>
<!ELEMENT PermanentLeaderEffect ( ChurchSupport | DoubleResources | LorenzoIlMangifico | NoMilitaryForTerritory | NoPayOccupiedTower | OccupiedSpace | NullLeaderEffect | FixedDiceValues | IncreaseDiceValues | DiscountLeaderEffect | MemberBonus ) >
<!ELEMENT InstantLeaderEffect ( CouncilBonus | PropertiesBonus | PrivilegesBonus | InstantWorkEffect | LeaderPickAnotherCard | NullLeaderEffect )>
<!ELEMENT NoMilitaryForTerritory ( Requirement* ) >
<!ELEMENT DevelopmentCardType (Building | Territory | Character | Venture )>
<!ELEMENT OccupiedSpace (Requirement*) >
<!ELEMENT NoPayOccupiedTower ( Requirement* )>
<!ELEMENT ChurchSupport ( Requirement* ) >
<!ELEMENT CouncilBonus ( Requirement* ) >
<!ELEMENT FixedDiceValues (Requirement*)>
<!ELEMENT IncreaseDiceValues (Requirement*)>
<!ELEMENT DoubleResources ( Requirement* )>
<!ELEMENT LorenzoIlMagnifico ( Requirement* )>
<!ELEMENT MemberBonus ( Requirement* ) >
<!ELEMENT PropertiesBonus (Requirement* , Properties)>
<!ELEMENT LeaderPickAnotherCard (Requirement*)>
<!ELEMENT InstantWorkEffect (Requirement*, WorkType) >
<!ELEMENT WorkType (Harvest|Production)>
<!ELEMENT PrivilegesBonus (Requirement*)>
<!ELEMENT DiscountLeaderEffect (Requirement*)>	


<!ELEMENT NullLeaderEffect EMPTY>

<!ELEMENT MemberColor ( Black | Orange | White | Neutral )>
<!ELEMENT Black EMPTY>
<!ELEMENT Orange EMPTY>
<!ELEMENT White EMPTY>
<!ELEMENT Neutral EMPTY>
<!ELEMENT Building EMPTY>
<!ELEMENT Territory EMPTY>
<!ELEMENT Character EMPTY>
<!ELEMENT Venture EMPTY>
<!ELEMENT Harvest EMPTY>
<!ELEMENT Production EMPTY>

<!ELEMENT Properties (Wood, Stones, Servants, Coins, MilitaryPoints, VictoryPoints, FaithPoints)>
<!ELEMENT Coins EMPTY>
<!ELEMENT Stones EMPTY>
<!ELEMENT Wood EMPTY>
<!ELEMENT Servants EMPTY>
<!ELEMENT MilitaryPoints EMPTY>
<!ELEMENT FaithPoints EMPTY>
<!ELEMENT VictoryPoints EMPTY>

<!ELEMENT CardsNumber (Green, Yellow, Blue, Purple)>
<!ELEMENT Green EMPTY>
<!ELEMENT Yellow EMPTY>
<!ELEMENT Blue EMPTY>
<!ELEMENT Purple EMPTY>


<!ATTLIST LeaderCard name CDATA #REQUIRED>
<!ATTLIST Coins value CDATA #REQUIRED>
<!ATTLIST Stones value CDATA #REQUIRED>
<!ATTLIST Wood value CDATA #REQUIRED>
<!ATTLIST Servants value CDATA #REQUIRED>
<!ATTLIST MilitaryPoints value CDATA #REQUIRED>
<!ATTLIST FaithPoints value CDATA #REQUIRED>
<!ATTLIST VictoryPoints value CDATA #REQUIRED>
<!ATTLIST Green value CDATA #REQUIRED>
<!ATTLIST Yellow value CDATA #REQUIRED>
<!ATTLIST Blue value CDATA #REQUIRED>
<!ATTLIST Purple value CDATA #REQUIRED>

<!ATTLIST PrivilegeEffect number CDATA #REQUIRED>
<!ATTLIST CouncilBonus number CDATA #REQUIRED>
<!ATTLIST MemberBonus value CDATA #REQUIRED>
<!ATTLIST InstantWorkEffect diceValue CDATA #REQUIRED>
<!ATTLIST FixedDiceValues whiteValue CDATA #REQUIRED orangeValue CDATA #REQUIRED blackValue CDATA #REQUIRED > 
<!ATTLIST IncreaseDiceValues whiteValue CDATA #REQUIRED orangeValue CDATA #REQUIRED blackValue CDATA #REQUIRED > 
<!ATTLIST PrivilegesBonus number CDATA #REQUIRED>
