<?xml version="1.0" ?>
<!DOCTYPE LeaderDeck SYSTEM "leader-deck-schema.dtd">
<LeaderDeck>
	<LeaderCard name="Francesco Sforza">
		<InstantLeaderEffect>
			<InstantWorkEffect diceValue="1">
			<Requirement>
        		        <Properties>
        		            <Wood value="0" />
        		            <Stones value="0" />
        		            <Servants value="0" />
        		            <Coins value="0" />
        		            <MilitaryPoints value="0" />
        		            <VictoryPoints value="0" />
        		            <FaithPoints value="0" />
        		        </Properties>
        		        <CardsNumber>
        		            <Green value="0" />
        		            <Yellow value="0" />
    		                <Blue value="0" />
    		                <Purple value="5" />
    		            </CardsNumber>
  		          </Requirement>
				<WorkType>
					<Harvest/>
				</WorkType>
			</InstantWorkEffect>
		</InstantLeaderEffect>
	</LeaderCard>
	<LeaderCard name="Lucrezia Borgia">
	<PermanentLeaderEffect>
			<IncreaseDiceValues whiteValue="2" blackValue="2" orangeValue="2">
			<Requirement>
        		        <Properties>
        		            <Wood value="0" />
        		            <Stones value="0" />
        		            <Servants value="0" />
        		            <Coins value="0" />
        		            <MilitaryPoints value="0" />
        		            <VictoryPoints value="0" />
        		            <FaithPoints value="0" />
        		        </Properties>
        		        <CardsNumber>
        		            <Green value="6" />
        		            <Yellow value="0" />
    		                <Blue value="0" />
    		                <Purple value="0" />
    		            </CardsNumber>
  		          </Requirement>
			<Requirement>
        		        <Properties>
        		            <Wood value="0" />
        		            <Stones value="0" />
        		            <Servants value="0" />
        		            <Coins value="0" />
        		            <MilitaryPoints value="0" />
        		            <VictoryPoints value="0" />
        		            <FaithPoints value="0" />
        		        </Properties>
        		        <CardsNumber>
        		            <Green value="0" />
        		            <Yellow value="6" />
    		                <Blue value="0" />
    		                <Purple value="0" />
    		            </CardsNumber>
  		          </Requirement>
			<Requirement>
        		        <Properties>
        		            <Wood value="0" />
        		            <Stones value="0" />
        		            <Servants value="0" />
        		            <Coins value="0" />
        		            <MilitaryPoints value="0" />
        		            <VictoryPoints value="0" />
        		            <FaithPoints value="0" />
        		        </Properties>
        		        <CardsNumber>
        		            <Green value="0" />
        		            <Yellow value="0" />
    		                <Blue value="6" />
    		                <Purple value="0" />
    		            </CardsNumber>
  		          </Requirement>
			<Requirement>
        		        <Properties>
        		            <Wood value="0" />
        		            <Stones value="0" />
        		            <Servants value="0" />
        		            <Coins value="0" />
        		            <MilitaryPoints value="0" />
        		            <VictoryPoints value="0" />
        		            <FaithPoints value="0" />
        		        </Properties>
        		        <CardsNumber>
        		            <Green value="0" />
        		            <Yellow value="0" />
    		                <Blue value="0" />
    		                <Purple value="6" />
    		            </CardsNumber>
  		          </Requirement>
			</IncreaseDiceValues>			
		</PermanentLeaderEffect>
	</LeaderCard>
	<LeaderCard name="Sisto IV">
	<PermanentLeaderEffect>
		<ChurchSupport>
		<Requirement>
        		        <Properties>
        		            <Wood value="6" />
        		            <Stones value="6" />
        		            <Servants value="6" />
        		            <Coins value="6" />
        		            <MilitaryPoints value="0" />
        		            <VictoryPoints value="0" />
        		            <FaithPoints value="0" />
        		        </Properties>
        		        <CardsNumber>
        		            <Green value="0" />
        		            <Yellow value="0" />
    		                <Blue value="0" />
    		                <Purple value="0" />
    		            </CardsNumber>
  		          </Requirement>		
		</ChurchSupport>
	</PermanentLeaderEffect>
	</LeaderCard>
	<LeaderCard name="Federico da Montefeltro">
	<InstantLeaderEffect>
		<LeaderPickAnotherCard>
			<Requirement>
        		        <Properties>
        		            <Wood value="0" />
        		            <Stones value="0" />
        		            <Servants value="0" />
        		            <Coins value="0" />
        		            <MilitaryPoints value="0" />
        		            <VictoryPoints value="0" />
        		            <FaithPoints value="0" />
        		        </Properties>
        		        <CardsNumber>
        		            <Green value="5" />
        		            <Yellow value="0" />
    		                <Blue value="0" />
    		                <Purple value="0" />
    		            </CardsNumber>
  		          </Requirement>
		</LeaderPickAnotherCard>
	</InstantLeaderEffect>
	</LeaderCard>
	<LeaderCard name="Bartolomeo Colleoni">
	<InstantLeaderEffect>
	<PropertiesBonus>
			<Requirement>
        		        <Properties>
        		            <Wood value="0" />
        		            <Stones value="0" />
        		            <Servants value="0" />
        		            <Coins value="0" />
        		            <MilitaryPoints value="0" />
        		            <VictoryPoints value="0" />
        		            <FaithPoints value="0" />
        		        </Properties>
        		        <CardsNumber>
        		            <Green value="4" />
        		            <Yellow value="0" />
    		                <Blue value="0" />
    		                <Purple value="2" />
    		            </CardsNumber>
  		          </Requirement>
			<Properties>
        		            <Wood value="0" />
        		            <Stones value="0" />
        		            <Servants value="0" />
        		            <Coins value="0" />
        		            <MilitaryPoints value="0" />
        		            <VictoryPoints value="4" />
        		            <FaithPoints value="0" />
        		 </Properties>
		</PropertiesBonus>
	</InstantLeaderEffect>
	</LeaderCard>
	<LeaderCard name="Michelangelo Bonarroti">
	<InstantLeaderEffect>
	<PropertiesBonus>
			<Requirement>
        		        <Properties>
        		            <Wood value="0" />
        		            <Stones value="10" />
        		            <Servants value="0" />
        		            <Coins value="0" />
        		            <MilitaryPoints value="0" />
        		            <VictoryPoints value="0" />
        		            <FaithPoints value="0" />
        		        </Properties>
        		        <CardsNumber>
        		            <Green value="0" />
        		            <Yellow value="0" />
    		                <Blue value="0" />
    		                <Purple value="0" />
    		            </CardsNumber>
  		          </Requirement>
			<Properties>
        		            <Wood value="0" />
        		            <Stones value="0" />
        		            <Servants value="0" />
        		            <Coins value="3" />
        		            <MilitaryPoints value="0" />
        		            <VictoryPoints value="0" />
        		            <FaithPoints value="0" />
        		 </Properties>
	</PropertiesBonus>
	</InstantLeaderEffect>
	</LeaderCard>
	<LeaderCard name="Cosime de' Medici">
	<InstantLeaderEffect>
	<PropertiesBonus>
			<Requirement>
        		        <Properties>
        		            <Wood value="0" />
        		            <Stones value="0" />
        		            <Servants value="0" />
        		            <Coins value="0" />
        		            <MilitaryPoints value="0" />
        		            <VictoryPoints value="0" />
        		            <FaithPoints value="0" />
        		        </Properties>
        		        <CardsNumber>
        		            <Green value="0" />
        		            <Yellow value="4" />
    		                <Blue value="2" />
    		                <Purple value="0" />
    		            </CardsNumber>
  		          </Requirement>
			<Properties>
        		            <Wood value="0" />
        		            <Stones value="0" />
        		            <Servants value="3" />
        		            <Coins value="0" />
        		            <MilitaryPoints value="0" />
        		            <VictoryPoints value="1" />
        		            <FaithPoints value="0" />
        		 </Properties>
		</PropertiesBonus>
	</InstantLeaderEffect>
	</LeaderCard>
	<LeaderCard name="Sandro Botticelli">
	<InstantLeaderEffect>
	<PropertiesBonus>
			<Requirement>
        		        <Properties>
        		            <Wood value="10" />
        		            <Stones value="0" />
        		            <Servants value="0" />
        		            <Coins value="0" />
        		            <MilitaryPoints value="0" />
        		            <VictoryPoints value="0" />
        		            <FaithPoints value="0" />
        		        </Properties>
        		        <CardsNumber>
        		            <Green value="0" />
        		            <Yellow value="0" />
    		                <Blue value="0" />
    		                <Purple value="0" />
    		            </CardsNumber>
  		          </Requirement>
			<Properties>
        		            <Wood value="0" />
        		            <Stones value="0" />
        		            <Servants value="0" />
        		            <Coins value="0" />
        		            <MilitaryPoints value="2" />
        		            <VictoryPoints value="1" />